{
  "$schema": "./tiles.schema.json",
  "version": "1.0",
  "tileset": "res://Assets/Terrain/TileSets/ByPack/FantasyDreamland.tres",
  "tiles": [
    {
      "id": "debug_path",
      "name": "Debug Path",
      "passability": "passable",
      "atlasCoords": {
        "x": 12,
        "y": 4
      },
      "sourceId": 12,
      "layer": "effects",
      "elevation": 0,
      "isTransparent": true
    },
    {
      "id": "debug_target",
      "name": "Debug Target",
      "passability": "passable",
      "atlasCoords": {
        "x": 4,
        "y": 6
      },
      "sourceId": 8,
      "layer": "effects",
      "elevation": 0,
      "isTransparent": true
    },
    {
      "id": "dirt",
      "name": "Dirt",
      "passability": "passable",
      "atlasCoords": {
        "x": 6,
        "y": 0
      },
      "sourceId": 0,
      "layer": "terrain",
      "elevation": 0,
      "isTransparent": true
    },
    {
      "id": "wall",
      "name": "Wall",
      "passability": "solid",
      "atlasCoords": {
        "x": 7,
        "y": 5
      },
      "sourceId": 3,
      "layer": "structure",
      "elevation": 1,
      "isTransparent": false
    },
    {
      "id": "stone",
      "name": "Stone",
      "passability": "solid",
      "atlasCoords": {
        "x": 0,
        "y": 6
      },
      "sourceId": 1,
      "layer": "structure",
      "elevation": 0.5,
      "isTransparent": false
    },
    {
      "id": "glass",
      "name": "Glass Wall",
      "passability": "solid",
      "atlasCoords": {
        "x": 29,
        "y": 28
      },
      "sourceId": 0,
      "layer": "structure",
      "elevation": 1,
      "isTransparent": true
    },
    {
      "id": "plains_grass",
      "name": "Plains Grass",
      "passability": "passable",
      "atlasCoords": {
        "x": 6,
        "y": 2
      },
      "sourceId": 12,
      "layer": "terrain",
      "elevation": 0,
      "isTransparent": true,
      "biomes": [
        "plains"
      ]
    },
    {
      "id": "plains_grass_tall",
      "name": "Tall Grass",
      "passability": "passable",
      "atlasCoords": {
        "x": 3,
        "y": 3
      },
      "sourceId": 12,
      "layer": "terrain",
      "elevation": 0,
      "isTransparent": true,
      "biomes": [
        "plains"
      ]
    },
    {
      "id": "plains_wildflowers",
      "name": "Wildflowers",
      "passability": "passable",
      "atlasCoords": {
        "x": 7,
        "y": 3
      },
      "sourceId": 1,
      "layer": "decoration",
      "elevation": 0,
      "isTransparent": true,
      "biomes": [
        "plains"
      ]
    },
    {
      "id": "plains_fertile_soil",
      "name": "Fertile Soil",
      "passability": "passable",
      "atlasCoords": {
        "x": 7,
        "y": 0
      },
      "sourceId": 11,
      "layer": "terrain",
      "elevation": 0,
      "isTransparent": true,
      "biomes": [
        "plains"
      ]
    },
    {
      "id": "plains_path",
      "name": "Dirt Path",
      "passability": "passable",
      "atlasCoords": {
        "x": 0,
        "y": 2
      },
      "sourceId": 3,
      "layer": "structure",
      "elevation": 0,
      "isTransparent": true,
      "biomes": [
        "plains"
      ]
    },
    {
      "id": "plains_small_rock",
      "name": "Small Rock",
      "passability": "solid",
      "atlasCoords": {
        "x": 11,
        "y": 5
      },
      "sourceId": 1,
      "layer": "structure",
      "elevation": 0.3,
      "isTransparent": false,
      "biomes": [
        "plains"
      ]
    },
    {
      "id": "plains_boulder",
      "name": "Boulder",
      "passability": "solid",
      "atlasCoords": {
        "x": 4,
        "y": 16
      },
      "sourceId": 17,
      "layer": "structure",
      "elevation": 0.6,
      "isTransparent": false,
      "biomes": [
        "plains"
      ]
    },
    {
      "id": "plains_shrub",
      "name": "Shrub",
      "passability": "solid",
      "atlasCoords": {
        "x": 12,
        "y": 12
      },
      "sourceId": 20,
      "layer": "decoration",
      "elevation": 0.4,
      "isTransparent": true,
      "biomes": [
        "plains"
      ]
    },
    {
      "id": "forest_floor",
      "name": "Forest Floor",
      "passability": "passable",
      "atlasCoords": {
        "x": 7,
        "y": 1
      },
      "sourceId": 11,
      "layer": "terrain",
      "elevation": 0,
      "isTransparent": true,
      "biomes": [
        "forest"
      ]
    },
    {
      "id": "forest_moss",
      "name": "Mossy Ground",
      "passability": "passable",
      "atlasCoords": {
        "x": 5,
        "y": 0
      },
      "sourceId": 14,
      "layer": "terrain",
      "elevation": 0,
      "isTransparent": true,
      "biomes": [
        "forest"
      ]
    },
    {
      "id": "forest_leaves",
      "name": "Fallen Leaves",
      "passability": "passable",
      "atlasCoords": {
        "x": 2,
        "y": 1
      },
      "sourceId": 1,
      "layer": "decoration",
      "elevation": 0,
      "isTransparent": true,
      "biomes": [
        "forest"
      ]
    },
    {
      "id": "forest_clearing",
      "name": "Forest Clearing",
      "passability": "passable",
      "atlasCoords": {
        "x": 4,
        "y": 4
      },
      "sourceId": 13,
      "layer": "terrain",
      "elevation": 0,
      "isTransparent": true,
      "biomes": [
        "forest"
      ],
      "size": {
        "x": 3,
        "y": 3
      },
      "autoTileVariants": [
        {
          "x": 3,
          "y": 5
        },
        {
          "x": 4,
          "y": 6
        },
        {
          "x": 4,
          "y": 4
        },
        {
          "x": 4,
          "y": 5
        },
        {
          "x": 2,
          "y": 4
        },
        {
          "x": 4,
          "y": 7
        },
        {
          "x": 5,
          "y": 4
        },
        {
          "x": 6,
          "y": 3
        },
        {
          "x": 6,
          "y": 6
        },
        {
          "x": 5,
          "y": 6
        },
        {
          "x": 6,
          "y": 7
        },
        {
          "x": 6,
          "y": 1
        },
        {
          "x": 6,
          "y": 5
        },
        {
          "x": 4,
          "y": 1
        },
        {
          "x": 4,
          "y": 3
        },
        {
          "x": 5,
          "y": 5
        }
      ],
      "tileMode": "autotile"
    },
    {
      "id": "forest_undergrowth",
      "name": "Undergrowth",
      "passability": "passable",
      "atlasCoords": {
        "x": 14,
        "y": 0
      },
      "sourceId": 1,
      "layer": "decoration",
      "elevation": 0,
      "isTransparent": true,
      "biomes": [
        "forest"
      ]
    },
    {
      "id": "forest_tree",
      "name": "Tree",
      "passability": "solid",
      "atlasCoords": {
        "x": 8,
        "y": 0
      },
      "sourceId": 11,
      "layer": "structure",
      "elevation": 2,
      "isTransparent": false,
      "biomes": [
        "forest"
      ],
      "size": {
        "x": 1,
        "y": 2
      }
    },
    {
      "id": "forest_dense_trees",
      "name": "Dense Trees",
      "passability": "solid",
      "atlasCoords": {
        "x": 0,
        "y": 0
      },
      "sourceId": 174,
      "layer": "structure",
      "elevation": 2.5,
      "isTransparent": true,
      "biomes": [
        "forest"
      ],
      "autoTileVariants": [
        null,
        {
          "x": 5,
          "y": 3
        },
        {
          "x": 5,
          "y": 1
        },
        {
          "x": 5,
          "y": 2
        },
        {
          "x": 7,
          "y": 1
        },
        {
          "x": 3,
          "y": 3
        },
        {
          "x": 6,
          "y": 1
        },
        {
          "x": 3,
          "y": 1
        },
        {
          "x": 7,
          "y": 3
        },
        {
          "x": 6,
          "y": 3
        },
        {
          "x": 4,
          "y": 3
        },
        {
          "x": 3,
          "y": 2
        },
        {
          "x": 7,
          "y": 2
        },
        {
          "x": 4,
          "y": 2
        },
        {
          "x": 4,
          "y": 1
        },
        {
          "x": 6,
          "y": 2
        }
      ],
      "tileMode": "autotile"
    },
    {
      "id": "forest_fallen_log",
      "name": "Fallen Log",
      "passability": "solid",
      "atlasCoords": {
        "x": 5,
        "y": 11
      },
      "sourceId": 3,
      "layer": "structure",
      "elevation": 0.3,
      "isTransparent": false,
      "biomes": [
        "forest"
      ]
    },
    {
      "id": "forest_mushrooms",
      "name": "Mushroom Patch",
      "passability": "solid",
      "atlasCoords": {
        "x": 2,
        "y": 22
      },
      "sourceId": 11,
      "layer": "decoration",
      "elevation": 0.2,
      "isTransparent": true,
      "biomes": [
        "forest"
      ]
    },
    {
      "id": "forest_stump",
      "name": "Tree Stump",
      "passability": "solid",
      "atlasCoords": {
        "x": 7,
        "y": 12
      },
      "sourceId": 18,
      "layer": "structure",
      "elevation": 0.4,
      "isTransparent": false,
      "biomes": [
        "forest"
      ]
    },
    {
      "id": "desert_sand",
      "name": "Sand",
      "passability": "passable",
      "atlasCoords": {
        "x": 36,
        "y": 44
      },
      "sourceId": 13,
      "layer": "terrain",
      "elevation": 0,
      "isTransparent": true,
      "biomes": [
        "desert"
      ],
      "size": {
        "x": 3,
        "y": 3
      },
      "autoTileVariants": [
        null,
        {
          "x": 36,
          "y": 46
        },
        {
          "x": 36,
          "y": 44
        },
        {
          "x": 36,
          "y": 45
        },
        {
          "x": 38,
          "y": 44
        },
        {
          "x": 36,
          "y": 47
        },
        {
          "x": 37,